{
  "metadata": {
    "language": "it",
    "pageTitle": "Sutra by Heart - Yoga Sutra di Patanjali"
  },
  "cover": {
    "kicker": "Yoga Sutra di Patanjali",
    "authorLabel": "Autori:",
    "voiceLabel": "Voce:",
    "importantNoteTitle": "Nota importante",
    "importantNote": "La voce che senti in questa app è del mio maestro, mentre le spiegazioni sono una mia interpretazione degli Yoga Sutra. Se trovi imprecisioni o errori, la colpa è solo ed esclusivamente mia. Usa questo strumento come una guida per lo studio, con la dovuta consapevolezza. -- Marco Buttu",
    "homeCount": "{chapters} capitoli · {sutras} sutra",
    "chapterCount": "{chapter} · {sutras}"
  },
  "home": {
    "studyTitle": "Studio",
    "studyDescription": "Scegli un capitolo per leggere, ascoltare e studiare i sutra.",
    "chapterLabel": "Capitolo {chapter}",
    "sutraCount": "{sutras} sutra",
    "continuousTitle": "Recitazione continua",
    "continuousDescription": "Scegli un capitolo, tutti i sutra oppure un intervallo e ascoltali in sequenza, una volta o a ripetizione."
  },
  "navigation": {
    "home": "Torna alla home",
    "chapterPosition": "Capitolo {chapter} di {total}"
  },
  "chapter": {
    "aboutTitle": "Il capitolo",
    "openingRecitation": "Recitazione iniziale",
    "closingRecitation": "Recitazione conclusiva",
    "documentDetail": "Yoga Sutra di Patanjali"
  },
  "sutra": {
    "wordsLabel": "Parole:",
    "meaningLabel": "Significato:",
    "explanationLabel": "Spiegazione",
    "playLabel": "Riproduci il sutra {number}"
  },
  "continuous": {
    "chapterLabel": "Capitolo",
    "selectionLabel": "Selezione",
    "allOption": "Tutti i sutra",
    "rangeOption": "Intervallo",
    "fromLabel": "Da",
    "toLabel": "A",
    "repeatLabel": "Ripeti in ciclo",
    "bellLabel": "Campana",
    "repetitionPauseLabel": "Pausa per ripetere",
    "pauseNoneOption": "Nessuna",
    "pauseBeforeOption": "Prima",
    "pauseAfterOption": "Dopo",
    "start": "Avvia",
    "pause": "Pausa",
    "resume": "Riprendi",
    "stop": "Interrompi",
    "repeatCurrent": "Ripeti",
    "ready": "Pronto per la riproduzione.",
    "bellPlaying": "Campana...",
    "bellPaused": "Campana in pausa.",
    "pauseBefore": "Pausa prima del sutra {number}.",
    "pauseAfter": "Pausa dopo il sutra {number}.",
    "pauseBeforePaused": "Pausa prima del sutra sospesa.",
    "pauseAfterPaused": "Pausa dopo il sutra sospesa.",
    "completed": "Riproduzione completata.",
    "trackStatus": "{state}: sutra {number} · {current} di {total}",
    "playingState": "In riproduzione",
    "pausedState": "In pausa",
    "replayingState": "Ripetizione in corso",
    "replayPausedState": "Ripetizione in pausa",
    "replayStatus": "{state}: sutra {number}",
    "noSutras": "Nessun sutra disponibile."
  },
  "verification": {
    "title": "Verifica",
    "selectionLabel": "Selezione",
    "allOption": "Tutti i sutra",
    "chapterOption": "Un capitolo",
    "rangeOption": "Intervallo",
    "chapterLabel": "Capitolo",
    "fromLabel": "Da",
    "toLabel": "A",
    "start": "Inizia",
    "next": "Prossimo sutra",
    "hint": "Suggerimento",
    "showSolution": "Mostra soluzione",
    "ready": "Scegli la selezione e premi Inizia.",
    "prompt": "Ricorda il sutra {number}",
    "hintLabel": "Suggerimento",
    "solutionLabel": "Soluzione",
    "meaningLabel": "Significato:",
    "playLabel": "Riproduci la soluzione del sutra {number}",
    "noSutras": "Nessun sutra disponibile per questa selezione."
  },
  "audio": {
    "play": "Play",
    "pause": "Pausa",
    "openingLabel": "{title}, {chapter}",
    "closingLabel": "{title}, {chapter}"
  },
  "errors": {
    "singlePlayback": "Impossibile riprodurre l'audio.",
    "sequenceTrack": "Impossibile riprodurre il sutra {number}.",
    "bellCue": "Impossibile riprodurre la campana.",
    "resume": "Impossibile riprendere la riproduzione.",
    "missingContent": "I dati dell'app non sono disponibili."
  }
}
